{
  "record_id": "pilot-impacts-of-land-system-change-driven-urban-heat-islands-on-surface-wat",
  "title": "Impacts of land system change\u2212\u2009driven urban heat islands on surface water dynamics and moisture conditions in Gauteng Province, South Africa",
  "url": "https://doi.org/10.1007/s43762-026-00290-5",
  "canonical_url": "https://doi.org/10.1007/s43762-026-00290-5",
  "stable_identifier": {
    "type": "doi",
    "value": "10.1007/s43762-026-00290-5",
    "url": "https://doi.org/10.1007/s43762-026-00290-5"
  },
  "platform_identifier": "W7202266542",
  "authors_or_organisation": [
    "Tamiranashe Kuwaza",
    "Paidamwoyo Mhangara",
    "Eskinder Gidey"
  ],
  "source_type": "academic-paper",
  "source_name": "Computational Urban Science",
  "source_domain": "doi.org",
  "publication_date": "2026-08-13",
  "retrieval_timestamp": "2026-08-14T19:07:34.493323+00:00",
  "discovery": {
    "run_id": "gate-3b-4a-20260814T120728",
    "adapter": "openalex",
    "query_id": "urban-learning-transfer",
    "query_version": "2.0.0"
  },
  "theme_assignments": {
    "primary": {
      "theme_id": "urban-climate-learning",
      "score": 0.72,
      "rationale": "Deterministic query-to-theme assignment for owner calibration; not an AI judgement."
    },
    "secondary": []
  },
  "geographies": [
    "global"
  ],
  "short_summary": "Abstract Surface water is a scarce resource in Gauteng, South Africa. This study analysed the impacts of urban heat islands on surface water dynamics and moisture conditions from 1984 to 2024 using vegetation and water indices in the Google Earth Engine. The results indicate that Gauteng has experienced a slight increase in land surface temperature (LST), ranging from 62\u00b0C to 63.2\u00b0C, and low LST decreased from 24.8\u00b0C to 10.32\u00b0C. The mean high LST was approximately 63.04\u00b0C, whereas the low LST value was 11.31\u00b0C. A higher vegetation cover, ranging from 0.66 in 1984 to 0.86 in 2014, and a lower v",
  "reason_for_relevance": "The source was retrieved by the bounded query for urban climate learning and requires calibration against the lab scope.",
  "novelty_significance": "The scale of the mapped literature provides a broad baseline for tracking gaps and change.",
  "evidence_basis": {
    "types": [
      "abstract"
    ],
    "description": "OpenAlex metadata and reconstructed abstract when supplied by the provider.",
    "sufficient_for_summary": true,
    "limitations": "Provider metadata was not a substitute for independent full-text review."
  },
  "ai_provenance": {
    "used": false,
    "model": null,
    "prompt_version": "research-watch-classification-v2-fixture",
    "run_id": "gate-3b-4a-20260814T120728",
    "structured_output_version": "2.0",
    "deterministic_transformations": [
      "query-theme calibration assignment",
      "abstract truncation"
    ]
  },
  "confidence": {
    "score": 0.72,
    "label": "medium",
    "basis": "Confidence reflects evidence availability and deterministic query assignment."
  },
  "review": {
    "status": "not_reviewed",
    "reviewer": null,
    "reviewed_date": null,
    "notes": null
  },
  "publication": {
    "decision": "published",
    "reasons": [
      "passed automatic publication controls"
    ],
    "checks_passed": [
      "source-url",
      "identifier",
      "disclosure",
      "bounded-run"
    ],
    "disclosure_version": "research-watch-disclosure-v1"
  },
  "reviewer_edits": [],
  "risk_flags": [
    "none"
  ],
  "correction_availability": {
    "status": "available",
    "date": null,
    "note": "Contact the lab to request a correction or removal review."
  },
  "event_cluster_id": "doi:10.1007/s43762-026-00290-5",
  "linked_sources": [],
  "captured_fixture": false
}
