{
  "record_id": "pilot-multi-hazard-risk-assessment-through-geospatial-analysis-and-machine-l",
  "title": "Multi hazard risk assessment through geospatial analysis and machine learning",
  "url": "https://doi.org/10.1007/s44282-026-00540-1",
  "canonical_url": "https://doi.org/10.1007/s44282-026-00540-1",
  "stable_identifier": {
    "type": "doi",
    "value": "10.1007/s44282-026-00540-1",
    "url": "https://doi.org/10.1007/s44282-026-00540-1"
  },
  "platform_identifier": "W7202269991",
  "authors_or_organisation": [
    "Payal Pidurkar",
    "Roshni.S. Khedgaonkar",
    "Sundeep Reddy Mallu",
    "Nikhil Mangrulkar",
    "Shreyas Rajendra Hole",
    "Sagarkumar S. Badhiye"
  ],
  "source_type": "academic-paper",
  "source_name": "Discover Global Society",
  "source_domain": "doi.org",
  "publication_date": "2026-08-12",
  "retrieval_timestamp": "2026-08-14T19:11:00.966901+00:00",
  "discovery": {
    "run_id": "gate-3b-4a-20260814T121055",
    "adapter": "openalex",
    "query_id": "urban-learning-transfer",
    "query_version": "2.0.0"
  },
  "theme_assignments": {
    "primary": {
      "theme_id": "urban-climate-learning",
      "score": 0.72,
      "rationale": "Deterministic query-to-theme assignment for owner calibration; not an AI judgement."
    },
    "secondary": []
  },
  "geographies": [
    "global"
  ],
  "short_summary": "Climate change, increased frequency of natural hazards and growing urban populations all have created a greater necessity for conducting comprehensive multi-hazard assessments using Geographical Information Systems (GIS). Therefore, this research paper proposes developing a machine learning and GIS based methodology to identify and map zones of multi-hazard risk through use of integrated geospatial and environmental variables. The framework incorporates multiple types of geospatial data sets that can be drawn from various sources which include; hydrology, topography, environment, climate and a",
  "reason_for_relevance": "The source was retrieved by the bounded query for urban climate learning and requires calibration against the lab scope.",
  "novelty_significance": "The scale of the mapped literature provides a broad baseline for tracking gaps and change.",
  "evidence_basis": {
    "types": [
      "abstract"
    ],
    "description": "OpenAlex metadata and reconstructed abstract when supplied by the provider.",
    "sufficient_for_summary": true,
    "limitations": "Provider metadata was not a substitute for independent full-text review."
  },
  "ai_provenance": {
    "used": false,
    "model": null,
    "prompt_version": "research-watch-classification-v2-fixture",
    "run_id": "gate-3b-4a-20260814T121055",
    "structured_output_version": "2.0",
    "deterministic_transformations": [
      "query-theme calibration assignment",
      "abstract truncation"
    ]
  },
  "confidence": {
    "score": 0.72,
    "label": "medium",
    "basis": "Confidence reflects evidence availability and deterministic query assignment."
  },
  "review": {
    "status": "not_reviewed",
    "reviewer": null,
    "reviewed_date": null,
    "notes": null
  },
  "publication": {
    "decision": "published",
    "reasons": [
      "passed automatic publication controls"
    ],
    "checks_passed": [
      "source-url",
      "identifier",
      "disclosure",
      "bounded-run"
    ],
    "disclosure_version": "research-watch-disclosure-v1"
  },
  "reviewer_edits": [],
  "risk_flags": [
    "none"
  ],
  "correction_availability": {
    "status": "available",
    "date": null,
    "note": "Contact the lab to request a correction or removal review."
  },
  "event_cluster_id": "doi:10.1007/s44282-026-00540-1",
  "linked_sources": [],
  "captured_fixture": false
}
