{
  "record_id": "pilot-fossil-fuel-occupations-show-high-transferability-across-the-wider-eco",
  "title": "Fossil fuel occupations show high transferability across the wider economy",
  "url": "https://doi.org/10.1038/s44458-026-00131-w",
  "canonical_url": "https://doi.org/10.1038/s44458-026-00131-w",
  "stable_identifier": {
    "type": "doi",
    "value": "10.1038/s44458-026-00131-w",
    "url": "https://doi.org/10.1038/s44458-026-00131-w"
  },
  "platform_identifier": "W7196958530",
  "authors_or_organisation": [
    "Qing Huang",
    "Chenglin Li",
    "Yangsiyu Lu"
  ],
  "source_type": "academic-paper",
  "source_name": "Communications Sustainability",
  "source_domain": "doi.org",
  "publication_date": "2026-08-06",
  "retrieval_timestamp": "2026-08-14T19:20:01.571459+00:00",
  "discovery": {
    "run_id": "gate-3b-4a-20260814T121957",
    "adapter": "openalex",
    "query_id": "workforce-switching",
    "query_version": "2.0.0"
  },
  "theme_assignments": {
    "primary": {
      "theme_id": "just-transitions-workforce",
      "score": 0.72,
      "rationale": "Deterministic query-to-theme assignment for owner calibration; not an AI judgement."
    },
    "secondary": []
  },
  "geographies": [
    "global"
  ],
  "short_summary": "Abstract The global decarbonization transition puts approximately 13 million fossil fuel jobs at risk under the International Energy Agency\u2019s Net Zero Emissions scenario. Existing research has predominantly focused on transition pathways for routine manual workers moving into green sectors, leaving economy-wide transition prospects across all fossil fuel occupation types poorly understood. Here we show, using employment and skills data from the U.S. Bureau of Labor Statistics and Department of Labor, that 77.4% of fossil fuel occupations exhibit high transferability to non-fossil fuel roles, w",
  "reason_for_relevance": "The source was retrieved by the bounded query for just transitions workforce and requires calibration against the lab scope.",
  "novelty_significance": "The scale of the mapped literature provides a broad baseline for tracking gaps and change.",
  "evidence_basis": {
    "types": [
      "abstract"
    ],
    "description": "OpenAlex metadata and reconstructed abstract when supplied by the provider.",
    "sufficient_for_summary": true,
    "limitations": "Provider metadata was not a substitute for independent full-text review."
  },
  "ai_provenance": {
    "used": false,
    "model": null,
    "prompt_version": "research-watch-classification-v2-fixture",
    "run_id": "gate-3b-4a-20260814T121957",
    "structured_output_version": "2.0",
    "deterministic_transformations": [
      "query-theme calibration assignment",
      "abstract truncation"
    ]
  },
  "confidence": {
    "score": 0.72,
    "label": "medium",
    "basis": "Confidence reflects evidence availability and deterministic query assignment."
  },
  "review": {
    "status": "not_reviewed",
    "reviewer": null,
    "reviewed_date": null,
    "notes": null
  },
  "publication": {
    "decision": "published",
    "reasons": [
      "passed automatic publication controls"
    ],
    "checks_passed": [
      "source-url",
      "identifier",
      "disclosure",
      "bounded-run"
    ],
    "disclosure_version": "research-watch-disclosure-v1"
  },
  "reviewer_edits": [],
  "risk_flags": [
    "none"
  ],
  "correction_availability": {
    "status": "available",
    "date": null,
    "note": "Contact the lab to request a correction or removal review."
  },
  "event_cluster_id": "doi:10.1038/s44458-026-00131-w",
  "linked_sources": [],
  "captured_fixture": false
}
