{
  "record_id": "pilot-motivation-to-learn-and-teach-home-economics-in-higher-education-predi",
  "title": "Motivation to learn and teach home economics in higher education: Predictors and comparative analysis",
  "url": "https://doi.org/10.1016/j.ssaho.2026.103414",
  "canonical_url": "https://doi.org/10.1016/j.ssaho.2026.103414",
  "stable_identifier": {
    "type": "doi",
    "value": "10.1016/j.ssaho.2026.103414",
    "url": "https://doi.org/10.1016/j.ssaho.2026.103414"
  },
  "platform_identifier": "W7202272361",
  "authors_or_organisation": [
    "Shaira Vita Mae G. Adviento",
    "Realyn Q. Salvador",
    "Chariza Mae B. Basamot",
    "Marc Laurence Q. Tamayo",
    "Shareen Kate A. Gamiao",
    "Daisy L. Franco",
    "Manelyn D. Salvador",
    "John Ryane A. Laureta",
    "Mark Raguindin Limon"
  ],
  "source_type": "academic-paper",
  "source_name": "Social Sciences & Humanities Open",
  "source_domain": "doi.org",
  "publication_date": "2026-08-12",
  "retrieval_timestamp": "2026-08-14T19:07:34.493672+00:00",
  "discovery": {
    "run_id": "gate-3b-4a-20260814T120728",
    "adapter": "openalex",
    "query_id": "urban-learning-transfer",
    "query_version": "2.0.0"
  },
  "theme_assignments": {
    "primary": {
      "theme_id": "urban-climate-learning",
      "score": 0.72,
      "rationale": "Deterministic query-to-theme assignment for owner calibration; not an AI judgement."
    },
    "secondary": []
  },
  "geographies": [
    "global"
  ],
  "short_summary": "Motivation, influenced by key personal and professional factors, plays a crucial role in the performance of both students and teachers. This study examined the motivational factors of higher education students and teachers in learning and teaching Home Economics (HE) in a state university. A total of 344 participants\u2014294 students and 50 teachers\u2014were surveyed using researcher-developed and adapted instruments. Data were analyzed using descriptive and inferential statistics at a 95% confidence level. HE students reported an overall motivation mean of 3.46, interpreted as \u201cfrequently motivated.\u201d",
  "reason_for_relevance": "The source was retrieved by the bounded query for urban climate learning and requires calibration against the lab scope.",
  "novelty_significance": "The scale of the mapped literature provides a broad baseline for tracking gaps and change.",
  "evidence_basis": {
    "types": [
      "abstract"
    ],
    "description": "OpenAlex metadata and reconstructed abstract when supplied by the provider.",
    "sufficient_for_summary": true,
    "limitations": "Provider metadata was not a substitute for independent full-text review."
  },
  "ai_provenance": {
    "used": false,
    "model": null,
    "prompt_version": "research-watch-classification-v2-fixture",
    "run_id": "gate-3b-4a-20260814T120728",
    "structured_output_version": "2.0",
    "deterministic_transformations": [
      "query-theme calibration assignment",
      "abstract truncation"
    ]
  },
  "confidence": {
    "score": 0.72,
    "label": "medium",
    "basis": "Confidence reflects evidence availability and deterministic query assignment."
  },
  "review": {
    "status": "not_reviewed",
    "reviewer": null,
    "reviewed_date": null,
    "notes": null
  },
  "publication": {
    "decision": "published",
    "reasons": [
      "passed automatic publication controls"
    ],
    "checks_passed": [
      "source-url",
      "identifier",
      "disclosure",
      "bounded-run"
    ],
    "disclosure_version": "research-watch-disclosure-v1"
  },
  "reviewer_edits": [],
  "risk_flags": [
    "none"
  ],
  "correction_availability": {
    "status": "available",
    "date": null,
    "note": "Contact the lab to request a correction or removal review."
  },
  "event_cluster_id": "doi:10.1016/j.ssaho.2026.103414",
  "linked_sources": [],
  "captured_fixture": false
}
